{
  "schema_version": "2.0",
  "artifact_type": "expert_route",
  "project_id": "coar-demo",
  "created_at": "2026-07-14T12:00:00Z",
  "updated_at": "2026-07-14T12:00:00Z",
  "extensions": {},
  "trial_id": "000001_test-main-signal",
  "move_pack": "moves/EXPERIMENT_TEST.md",
  "domain_packs": [
    "domains/general_research/DOMAIN.md"
  ],
  "method_packs": [],
  "venue_profile": null,
  "risk_flags": [
    "claim_evidence"
  ],
  "required_standards": [
    "Use a named baseline and one interpretable metric."
  ],
  "missing_packs": [],
  "review_triggers": [
    "external_sources_or_new_citations"
  ],
  "requested_review_level": "standard"
}
